Customer Query,Query Details,Possible Solution 1,Possible Solution 2,Possible Solution 3,Additional Points
Order not received,Customer hasn't received order after 10 days,Check order status online,Contact customer support,Initiate investigation for lost packages,Ensure customer has tracking number
Product damaged,Item received is damaged,Request a replacement,Request a refund,Contact the manufacturer for feedback,Provide photos of the damage
Payment issue,Payment failed but amount deducted,Check with the bank,Contact customer support,Verify payment gateway integration,Provide transaction ID
Warranty claim,Electronics item not working under warranty,Contact service center,Submit a warranty claim form,Request a replacement or repair,Provide purchase proof and warranty details
Wrong item received,Wrong product delivered,Request a replacement,Return the wrong item for exchange,Initiate a refund process,Provide order details and photos
Installation issue,Trouble installing electronics item,Schedule a technician visit,Provide detailed installation instructions,Contact customer support for troubleshooting,Provide product model and issue details
Product not as described,Product doesn't match description online,Request a return,Contact customer support,Review product specifications,Provide order and product details
Delivery delay,Order delayed beyond estimated delivery date,Check order status online,Contact delivery service for updates,Contact customer support for resolution,Provide tracking number and order details
Account issue,Unable to log in to account,Reset password,Contact customer support,Check for account lockout notifications,Provide account email and issue details
Refund not processed,Refund not received after returning product,Check refund status online,Contact customer support,Coordinate with financial department,Provide return and refund details
Discount not applied,Promotional discount not applied at checkout,Apply discount code again,Contact customer support,Review promotional terms,Provide order details and promo code
Product availability,Product shown as out of stock online,Sign up for restock notifications,Check nearby stores,Contact customer support for updates,Provide product details
Subscription issue,Trouble with subscription service,Check subscription status online,Contact customer support,Modify subscription settings,Provide subscription details
Price match request,Found lower price elsewhere,Submit price match request,Review price match policy,Contact customer support for approval,Provide competitor's price details
Return policy query,Question about return policy for electronics,Check return policy online,Contact customer support,Visit local store for details,Provide product details
Loyalty points issue,Loyalty points not credited,Check loyalty points balance online,Contact customer support,Review recent transactions,Provide account and transaction details
Gift card issue,Trouble using gift card at checkout,Check gift card balance,Contact customer support,Review gift card terms and conditions,Provide gift card and transaction details
Shipping cost query,Question about high shipping costs,Check shipping policy online,Contact customer support,Look for free shipping promotions,Provide order details
Product recall,Received notification about product recall,Follow recall instructions,Contact customer support,Arrange for product return,Provide recall notice and product details
Invoice request,Request for a copy of the invoice,Download invoice from account,Contact customer support,Check email for invoice,Provide order details
Bulk order discount,Inquiry about discount for bulk orders,Check bulk order policy online,Contact customer support,Request a custom quote,Provide details of bulk order
Expired product,Received product past expiration date,Request a replacement,Request a refund,Contact customer support for guidance,Provide order and product details
Technical support,Trouble with electronic device functionality,Follow troubleshooting guide,Contact technical support,Schedule a technician visit,Provide product model and issue details
Return status,Checking status of returned item,Check return status online,Contact customer support,Track return shipment,Provide return and tracking details
Gift wrapping request,Inquiry about gift wrapping services,Check gift wrapping options online,Contact customer support,Arrange for gift wrapping,Provide order details
Loyalty program benefits,Question about benefits of loyalty program,Check loyalty program details online,Contact customer support,Review membership benefits,Provide loyalty program details
Out of stock notification,Inquiry about notification for back-in-stock items,Sign up for restock notifications,Contact customer support,Check store availability,Provide product details
Order cancellation,Request to cancel order before shipping,Cancel order online,Contact customer support,Review cancellation policy,Provide order details
Delivery instructions,Special instructions for delivery,Add instructions in delivery preferences online,Contact delivery service,Coordinate with customer for specifics,Provide order and delivery details
Feedback and suggestions,Providing feedback or suggestions for improvement,Submit feedback through customer portal,Contact customer support,Leave a review or suggestion online,Provide detailed feedback
